{
  "$schema": "./acceptance-evidence.schema.json",
  "schemaVersion": 1,
  "product": "OpenDelegate",
  "milestone": "first",
  "auditedAt": "2026-07-24T06:44:00.619Z",
  "sourceCommit": "404e432bcf2547ad206ed9e3c6d996f0cdd05d3d",
  "releaseStatus": "blocked",
  "criteria": [
    {
      "id": 1,
      "title": "Agent-first init reaches Main and Admin without a development command",
      "implementationStatus": "partial",
      "liveProofStatus": "not-run",
      "evidence": [
        "skills/opendelegate-init/SKILL.md",
        "docs/adr/0010-reproducible-platform-bundles-and-provenance.md",
        "tooling/build-release.mjs",
        "tooling/test/build-release.test.mjs",
        "apps/main/src/cli.ts",
        "apps/main/test/main-runtime.test.ts"
      ],
      "nextGate": "Run the pinned bundle and init skill on clean macOS, Windows, and Linux hosts; implement and install the production service commands, then record startup and Admin auto-open proof."
    },
    {
      "id": 2,
      "title": "Only the current Device appears initially",
      "implementationStatus": "partial",
      "liveProofStatus": "not-run",
      "evidence": [
        "apps/main/test/main-runtime.test.ts",
        "apps/control-plane/test/control-plane-http.test.ts",
        "apps/admin-web/src/AdminApplication.test.tsx",
        "apps/admin-web/e2e/admin-overview.spec.ts"
      ],
      "nextGate": "Run the packaged Main and real Admin API from a clean home, record that only the current Device appears before enrollment, and prove that the list expands only after a successful grant enrollment."
    },
    {
      "id": 3,
      "title": "Embedded SQLite and external PostgreSQL both work",
      "implementationStatus": "partial",
      "liveProofStatus": "not-run",
      "evidence": [
        "docs/adr/0005-sql-portability-and-transaction-semantics.md",
        "packages/storage-sql/test/sql-event-store.contract.test.ts",
        "packages/storage-sql/test/sql-owner-auth-repository.contract.test.ts",
        "packages/acceptance/test/phase2-sql-persistence.test.ts",
        "apps/main/test/main-runtime.test.ts",
        ".github/workflows/ci.yml"
      ],
      "nextGate": "Run the final-commit PostgreSQL CI job and clean-bundle SQLite and external-PostgreSQL smokes, then capture migration and backup/restore proof for both deployment choices."
    },
    {
      "id": 4,
      "title": "An approved Discord Community Server and Forum bind successfully",
      "implementationStatus": "partial",
      "liveProofStatus": "blocked-external",
      "evidence": [
        "packages/discord-adapter/README.md",
        "packages/discord-adapter/src/discord-forum-adapter.ts",
        "packages/discord-adapter/test/discord-forum-adapter.test.ts"
      ],
      "nextGate": "Implement the production Discord HTTP, Gateway, Main SQL-state, and Secret-backed credential ports, then bind a dedicated Community Forum and record permission, intent, Gateway Resume, and HTTP reconciliation proof."
    },
    {
      "id": 5,
      "title": "macOS, Windows, and Linux Devices enroll with single-use grants",
      "implementationStatus": "partial",
      "liveProofStatus": "blocked-external",
      "evidence": [
        "docs/adr/0008-device-identity-enrollment-and-channel-authentication.md",
        "packages/device-identity/README.md",
        "packages/device-identity/src/device-identity-authority.ts",
        "packages/device-identity/test/device-identity.test.ts"
      ],
      "nextGate": "Compose the identity core with persistent Main and OS Secret Stores, pinned enrollment HTTP, active-channel revocation, and a join skill, then enroll real macOS, Windows, and Linux Devices."
    },
    {
      "id": 6,
      "title": "Every OS service survives process and expected host restart",
      "implementationStatus": "partial",
      "liveProofStatus": "blocked-external",
      "evidence": [
        "docs/adr/0011-native-two-plane-service-supervision-and-authenticated-ipc.md",
        "packages/platform-services/README.md",
        "packages/platform-services/test/renderers.test.ts",
        "packages/platform-services/test/plans.test.ts",
        "tooling/build-release.mjs"
      ],
      "nextGate": "Implement the privileged filesystem and supervisor adapters, durable operation journal, service hosts, and authenticated IPC, then capture clean install, restart, reboot, login/logout, upgrade, rollback, and uninstall proof on all three OS families."
    },
    {
      "id": 7,
      "title": "Device specification, routes, health, locks, and Runs are accurate",
      "implementationStatus": "partial",
      "liveProofStatus": "not-run",
      "evidence": [
        "packages/device-discovery/test/device-discovery-service.test.ts",
        "packages/worker-runtime/test/worker-runtime.test.ts",
        "packages/platform-services/test/readiness.test.ts",
        "apps/main/test/main-runtime.test.ts",
        "apps/admin-web/src/AdminApplication.test.tsx"
      ],
      "nextGate": "Compose enrolled Worker observations, profile revisions, routes, locks, load, and current Runs into durable Main projections and verify the complete Device surface against real Devices."
    },
    {
      "id": 8,
      "title": "Per-Device connection methods are deterministic and prompt-free",
      "implementationStatus": "partial",
      "liveProofStatus": "blocked-external",
      "evidence": [
        "packages/transport/test/transport-resolver.test.ts",
        "packages/worker-runtime/test/worker-runtime.test.ts",
        "packages/worker-runtime/test/state-boundaries.test.ts"
      ],
      "nextGate": "Compose authenticated Worker channels over configured endpoints and prove different real Tailscale, Omada, and direct profiles, including redacted diagnostics and prompt inspection after deterministic exhaustion."
    },
    {
      "id": 9,
      "title": "One Forum post creates one Task and replies resume it",
      "implementationStatus": "partial",
      "liveProofStatus": "blocked-external",
      "evidence": [
        "packages/discord-adapter/test/discord-forum-adapter.test.ts",
        "packages/task-service/test/task-service.test.ts",
        "packages/acceptance/test/canonical-task-journey.test.ts"
      ],
      "nextGate": "Compose the Discord adapter with the durable Main Task service and production Gateway/HTTP ports, then prove post and reply identity through live ingestion, reconnect, and archived-thread reconciliation."
    },
    {
      "id": 10,
      "title": "Different Forum posts remain context-isolated Tasks",
      "implementationStatus": "partial",
      "liveProofStatus": "blocked-external",
      "evidence": [
        "packages/discord-adapter/test/discord-forum-adapter.test.ts",
        "packages/task-service/test/task-service.test.ts",
        "packages/orchestrator/test/orchestration-boundaries.test.ts"
      ],
      "nextGate": "Prove distinct live Forum posts create distinct durable Tasks, Coordinator Sessions, summaries, and provider-native session bindings with no cross-Task prompt input."
    },
    {
      "id": 11,
      "title": "Clear work auto-starts and ambiguity asks one useful question",
      "implementationStatus": "partial",
      "liveProofStatus": "not-run",
      "evidence": [
        "packages/task-service/test/task-service.test.ts",
        "packages/configuration/test/configuration-service.test.ts",
        "packages/acceptance/test/phase1-public-contracts.test.ts"
      ],
      "nextGate": "Compose a real Coordinator adapter and Discord projection so clear Auto work starts and ambiguous work persists and presents exactly one targeted owner question."
    },
    {
      "id": 12,
      "title": "Main parallelizes work across two Devices and synthesizes reports",
      "implementationStatus": "partial",
      "liveProofStatus": "blocked-external",
      "evidence": [
        "packages/orchestrator/test/orchestration-lifecycle.test.ts",
        "packages/acceptance/test/phase1-public-contracts.test.ts",
        "packages/worker-runtime/test/worker-runtime.test.ts"
      ],
      "nextGate": "Compose the Worker protocol and real Agent adapters, then run one Task through parallel Work Orders on two enrolled real Devices and record Main's synthesized result."
    },
    {
      "id": 13,
      "title": "General Runs are concurrent while desktop input is exclusive",
      "implementationStatus": "partial",
      "liveProofStatus": "blocked-external",
      "evidence": [
        "docs/adr/0012-computer-use-native-driver-authority-and-readiness.md",
        "packages/resource-locks/test/resource-lock-kernel.test.ts",
        "packages/computer-use/test/computer-use.test.ts",
        "packages/computer-use-os/test/computer-use-os.test.ts",
        "packages/platform-services/test/readiness.test.ts"
      ],
      "nextGate": "Compose durable Resource Locks, external monotonic desktop authority, and authenticated native helpers, then prove real desktop-session serialization while unrelated Agent Runs remain concurrent."
    },
    {
      "id": 14,
      "title": "Codex and Claude adapters start, observe, and resume native sessions",
      "implementationStatus": "partial",
      "liveProofStatus": "blocked-external",
      "evidence": [
        "packages/agent-adapters/README.md",
        "packages/agent-adapters/src/contracts.ts",
        "packages/agent-adapters/test/codex-cli-adapter.test.ts",
        "packages/agent-adapters/test/claude-cli-adapter.test.ts",
        "packages/agent-adapters/test/subprocess-lifecycle.test.ts"
      ],
      "nextGate": "Add the SDK-native approval and steering paths, compose adapters into the Worker and durable Main session registry, then run authenticated pinned Codex and Claude start, stream, resume, cancel, and restart smokes."
    },
    {
      "id": 15,
      "title": "Coordinator pinning and Worker provider participation are correct",
      "implementationStatus": "partial",